<?xml version="1.0" encoding="UTF-8"?>
<desenvolupadors xmlns:xsi="http://www.w3.org/2001/XMLSchema-instance" xsi:noNamespaceSchemaLocation="Ex2.xsd">
    <nom>Desenvolupadors Back-End</nom>
    <treballador>
        <nom>Perico Palotes</nom>
        <email>
            <mailp>perico@gmail.com</mailp>
            <mailc>perpal@empresa.com</mailc>
        </email>
        <codi>78956</codi>
        <adressa>
            <ciutat>Barcelona</ciutat>
            <provincia>Barcelona</provincia>
            <codpos>08080</codpos>
        </adressa>
    </treballador>
    <treballador>
        <nom>Maria Antonieta</nom>
        <email>
            <mailp>maria@gmail.com</mailp>
            <mailc>maran@empresa.com</mailc>
        </email>
        <codi>54682</codi>
        <adressa>
            <ciutat>Barcelona</ciutat>
            <provincia>Barcelona</provincia>
            <codpos>08080</codpos>
        </adressa>
    </treballador>
</desenvolupadors>